{
  "profileId": "generic-maa-log",
  "session_id": "replace-with-your-session-id",
  "inputs": [
    {
      "path": "/absolute/path/to/your/logs-or-zip",
      "kind": "folder"
    }
  ],
  "queries": {
    "task_overview": {},
    "raw_lines": {
      "task_id": 1,
      "keywords": ["Error", "timeout"],
      "limit": 20
    }
  }
}
